nombre,precio,url,tienda
Pan de mesa Carrefour classic con salvado 620 g.,"$ 3 106,10",https://www.carrefour.com.ar/pan-de-mesa-carrefour-classic-con-salvado-620-g/p,Carrefour
Pan para hamburguesas Bimbo artesano 4 uni,"$ 3 025,00",https://www.carrefour.com.ar/pan-para-hamburguesas-bimbo-artesano-4-uni-715678/p,Carrefour
Pan rallado Preferido fortificado 1 kg.,"$ 2 137,50",https://www.carrefour.com.ar/pan-rallado-preferido-fortificado-1-kg-731021/p,Carrefour
Pan de salvado Lactal rodajas finas 560 g.,"$ 4 370,00",https://www.carrefour.com.ar/pan-de-salvado-lactal-rodajas-finas-560-g-716486/p,Carrefour
Pan integral fargo bolsa 400 grs,"$ 2 487,00",https://www.carrefour.com.ar/pan-integral-fargo-bolsa-400-grs-758013/p,Carrefour
Pan rallado Mamá Cocina fortificado 500 g.,"$ 1 199,00",https://www.carrefour.com.ar/pan-rallado-mama-cocina-fortificado-500-g/p,Carrefour
